section,title,description
343,"BNS Section 343 - Fraudulent cancellation, destruction, etc., of will, authority to adopt, or valuable security.","B.N.S 343, Fraudulent cancellation, destruction, etc., of will, authority to adopt, or valuable security."
345,BNS Section 345 - Property mark.,"B.N.S 345, Property mark."
346,BNS Section 346 - Tampering with property mark with intent to cause injury.,"B.N.S 346, Tampering with property mark with intent to cause injury."
347,BNS Section 347 - Counterfeiting a property mark.,"B.N.S 347, Counterfeiting a property mark."
348,BNS Section 348 - Making or possession of any instrument for counterfeiting a property mark.,"B.N.S 348, Making or possession of any instrument for counterfeiting a property mark."
349,BNS Section 349 - Selling goods marked with a counterfeit property mark.,"B.N.S 349, Selling goods marked with a counterfeit property mark."
350,BNS Section 350 - Making a false mark upon any receptacle containing goods.,"B.N.S 350, Making a false mark upon any receptacle containing goods."
351,BNS Section 351 - Criminal intimidation.,"B.N.S 351, Criminal intimidation."
352,BNS Section 352 - Intentional insult with intent to provoke breach of peace.,"B.N.S 352, Intentional insult with intent to provoke breach of peace."
354,BNS Section 354 - Act caused by inducing person to believe that he will be rendered an object of the Divine displeasure.,"B.N.S 354, Act caused by inducing person to believe that he will be rendered an object of the Divine displeasure."
355,BNS Section 355 - Misconduct in public by a drunken person.,"B.N.S 355, Misconduct in public by a drunken person."
356,BNS Section 356 - Defamation.,"B.N.S 356, Defamation."
353,BNS Section 353 - Statements conducing to public mischief.,"B.N.S 353, Statements conducing to public mischief."
357,BNS Section 357 - Breach of contract to attend on and supply wants of helpless person.,"B.N.S 357, Breach of contract to attend on and supply wants of helpless person."
358,BNS Section 358 - Repeal and savings.,"B.N.S 358, Repeal and savings."
